{
  "$schema": "https://json-schema.org/draft/2020-12/schema",
  "$id": "https://cdn.jsdelivr.net/gh/walktalkmeditate/open-pilgrimages@v1/schema/way.schema.json",
  "title": "Pilgrimage Stage Way",
  "description": "One stage of a pilgrimage route, in the wire format the Pilgrim iOS app's PilgrimageWayImporter reads. Flat moments, no source field, every stage field required. A change here is a change to the app.",
  "type": "object",
  "required": [
    "schemaVersion", "id", "title", "departedAt",
    "route", "totalDistanceMeters", "theirActiveSeconds", "moments", "marks", "stage"
  ],
  "properties": {
    "schemaVersion": { "type": "string", "pattern": "^\\d+\\.\\d+\\.\\d+$" },
    "id": { "type": "string", "pattern": "^pilgrimage:[a-z0-9-]{1,64}:[0-9]{1,3}$" },
    "title": { "type": "string", "minLength": 1, "maxLength": 120 },
    "departedAt": {
      "type": "string",
      "pattern": "^\\d{4}-\\d{2}-\\d{2}T\\d{2}:\\d{2}:\\d{2}Z$",
      "description": "Whole-second UTC. Never shown for a stage."
    },
    "tzIdentifier": { "type": "string", "minLength": 1, "maxLength": 64 },
    "route": {
      "type": "array",
      "minItems": 2,
      "maxItems": 1000,
      "items": { "$ref": "#/$defs/RoutePoint" }
    },
    "totalDistanceMeters": { "type": "number", "exclusiveMinimum": 0, "maximum": 400000 },
    "theirActiveSeconds": { "type": "number", "exclusiveMinimum": 0, "maximum": 172800 },
    "moments": { "type": "array", "maxItems": 200, "items": { "$ref": "#/$defs/Moment" } },
    "marks": { "type": "array", "maxItems": 400, "items": { "$ref": "#/$defs/Mark" } },
    "stage": { "$ref": "#/$defs/Stage" }
  },
  "additionalProperties": false,

  "$defs": {
    "Coordinate": {
      "type": "object",
      "required": ["lat", "lon"],
      "properties": {
        "lat": { "type": "number", "minimum": -90, "maximum": 90 },
        "lon": { "type": "number", "minimum": -180, "maximum": 180 }
      },
      "additionalProperties": false
    },
    "RoutePoint": {
      "type": "object",
      "required": ["lat", "lon", "t"],
      "properties": {
        "lat": { "type": "number", "minimum": -90, "maximum": 90 },
        "lon": { "type": "number", "minimum": -180, "maximum": 180 },
        "alt": { "type": "number", "minimum": -500, "maximum": 9000 },
        "t": { "type": "number", "minimum": 0, "maximum": 172800 }
      },
      "additionalProperties": false
    },
    "Moment": {
      "type": "object",
      "description": "Flat: kind is the string \"waypoint\", with label and icon as siblings. The nested single-key object Way's synthesized Codable would write is exactly what this shape exists to reject.",
      "required": ["id", "frac", "kind", "label", "icon", "at", "pin"],
      "properties": {
        "id": { "type": "string", "minLength": 1, "maxLength": 80 },
        "frac": { "type": "number", "minimum": 0, "maximum": 1 },
        "kind": { "const": "waypoint" },
        "label": { "type": "string", "minLength": 1, "maxLength": 80 },
        "icon": { "type": "string", "minLength": 1, "maxLength": 64 },
        "text": { "type": "string", "minLength": 1, "maxLength": 600 },
        "names": {
          "type": "object",
          "minProperties": 1,
          "additionalProperties": { "type": "string", "minLength": 1, "maxLength": 120 }
        },
        "sitMinutes": { "type": "integer", "minimum": 1, "maximum": 60 },
        "at": { "$ref": "#/$defs/Coordinate" },
        "pin": { "$ref": "#/$defs/Coordinate" }
      },
      "additionalProperties": false
    },
    "Mark": {
      "type": "object",
      "required": ["id", "kind", "name", "at", "frac", "offLineMeters"],
      "properties": {
        "id": { "type": "string", "minLength": 1, "maxLength": 80 },
        "kind": { "type": "string", "enum": ["water", "food", "bed", "transport", "supply", "medical"] },
        "name": { "type": "string", "minLength": 1, "maxLength": 80 },
        "at": { "$ref": "#/$defs/Coordinate" },
        "frac": { "type": "number", "minimum": 0, "maximum": 1 },
        "offLineMeters": { "type": "number", "minimum": 0, "maximum": 300 }
      },
      "additionalProperties": false
    },
    "Stage": {
      "type": "object",
      "description": "Every field required: the app's WayStage declares them non-optional. The build writes an empty string or array where the dataset is silent.",
      "required": [
        "routeId", "index", "count", "name", "theme", "narrative", "closing",
        "warnings", "distanceKm", "gainMeters", "hours", "difficulty", "start", "end"
      ],
      "properties": {
        "routeId": { "type": "string", "pattern": "^[a-z0-9-]{1,64}$" },
        "index": { "type": "integer", "minimum": 0, "maximum": 199 },
        "count": { "type": "integer", "minimum": 1, "maximum": 200 },
        "name": { "type": "string", "minLength": 1, "maxLength": 120 },
        "theme": { "type": "string", "maxLength": 80 },
        "narrative": { "type": "string", "maxLength": 2000 },
        "closing": { "type": "string", "maxLength": 400 },
        "warnings": {
          "type": "array",
          "maxItems": 10,
          "items": { "type": "string", "minLength": 1, "maxLength": 300 }
        },
        "distanceKm": { "type": "number", "exclusiveMinimum": 0, "maximum": 400 },
        "gainMeters": { "type": "number", "minimum": 0, "maximum": 10000 },
        "hours": {
          "type": "object",
          "required": ["min", "max"],
          "properties": {
            "min": { "type": "number", "exclusiveMinimum": 0, "maximum": 48 },
            "max": { "type": "number", "exclusiveMinimum": 0, "maximum": 48 }
          },
          "additionalProperties": false
        },
        "difficulty": { "type": "string", "enum": ["easy", "moderate", "hard", "expert", ""] },
        "start": { "$ref": "#/$defs/Place" },
        "end": { "$ref": "#/$defs/Place" }
      },
      "additionalProperties": false
    },
    "Place": {
      "type": "object",
      "required": ["name", "at"],
      "properties": {
        "name": { "type": "string", "minLength": 1, "maxLength": 120 },
        "at": { "$ref": "#/$defs/Coordinate" }
      },
      "additionalProperties": false
    }
  }
}
